<?xml version="1.0" encoding="UTF-8"?>
<!DOCTYPE VNCLASS SYSTEM "vn_class-3.dtd">
<VNCLASS ID="hurt-40.8.3" xmlns:xsi="http://www.w3.org/2001/XMLSchema-instance" xsi:noNamespaceSchemaLocation="vn_schema-3.xsd">
    <MEMBERS/>
    <THEMROLES>
        <THEMROLE type="Experiencer">
            <SELRESTRS>
                <SELRESTR Value="+" type="animate"/>
            </SELRESTRS>
        </THEMROLE>
        <THEMROLE type="Patient">
            <SELRESTRS logic="or">
                <SELRESTR Value="+" type="body_part"/>
                <SELRESTR Value="+" type="refl"/>
            </SELRESTRS>
        </THEMROLE>
    </THEMROLES>
    <FRAMES/>
    <SUBCLASSES>
        <VNSUBCLASS ID="hurt-40.8.3-1">
            <MEMBERS>
                <MEMBER name="stub" wn="stub%2:29:00"/>
            </MEMBERS>
            <THEMROLES>
                <THEMROLE type="Patient">
                    <SELRESTRS>
                        <SELRESTR Value="+" type="body_part"/>
                    </SELRESTRS>
                </THEMROLE>
            </THEMROLES>
            <FRAMES>
                <FRAME>
                    <DESCRIPTION descriptionNumber="7.6" primary="Unintentional Interpretation of Object" secondary="Body_part Object" xtag=""/>
                    <EXAMPLES>
                        <EXAMPLE>Tessa hurt/sprained her ankle.</EXAMPLE>
                    </EXAMPLES>
                    <SYNTAX>
                        <NP value="Experiencer">
                            <SYNRESTRS/>
                        </NP>
                        <VERB/>
                        <NP value="Patient">
                            <SYNRESTRS/>
                        </NP>
                    </SYNTAX>
                    <SEMANTICS>
                        <PRED value="harmed">
                            <ARGS>
                                <ARG type="Event" value="during(E)"/>
                                <ARG type="ThemRole" value="Patient"/>
                            </ARGS>
                        </PRED>
                        <PRED value="experience">
                            <ARGS>
                                <ARG type="Event" value="E"/>
                                <ARG type="ThemRole" value="Experiencer"/>
                            </ARGS>
                        </PRED>
                    </SEMANTICS>
                </FRAME>
            </FRAMES>
            <SUBCLASSES>
                <VNSUBCLASS ID="hurt-40.8.3-1-1">
                    <MEMBERS>
                        <!--verb adds manner predicate for how the Patient is hurt-->
                        <MEMBER name="break" wn="break%2:35:13 break%2:35:09 break%2:30:15 break%2:29:04"/>
                        <MEMBER name="chip" wn="chip%2:35:00"/>
                        <MEMBER name="fracture" wn="fracture%2:29:02 fracture%2:29:01 fracture%2:29:00"/>
                        <MEMBER name="pull" wn="pull%2:29:00"/>
                        <MEMBER name="rupture" wn="rupture%2:35:00"/>
                        <MEMBER name="split" wn="split%2:35:00"/>
                        <MEMBER name="sprain" wn="sprain%2:29:00"/>
                        <MEMBER name="turn" wn="turn%2:29:00"/>
                        <MEMBER name="twist" wn="twist%2:29:00"/>
                    </MEMBERS>
                    <THEMROLES/>
                    <FRAMES>
                        <FRAME>
                            <DESCRIPTION descriptionNumber="0.1" primary="Intransitive" secondary="" xtag="0.1"/>
                            <EXAMPLES>
                                <EXAMPLE>My ankle twisted.</EXAMPLE>
                            </EXAMPLES>
                            <SYNTAX>
                                <NP value="Patient">
                                    <SYNRESTRS/>
                                </NP>
                                <VERB/>
                            </SYNTAX>
                            <SEMANTICS>
                                <PRED value="harmed">
                                    <ARGS>
                                        <ARG type="Event" value="during(E)"/>
                                        <ARG type="ThemRole" value="Patient"/>
                                    </ARGS>
                                </PRED>
                                <PRED value="experience">
                                    <ARGS>
                                        <ARG type="Event" value="E"/>
                                        <ARG type="ThemRole" value="?Experiencer"/>
                                    </ARGS>
                                </PRED>
                            </SEMANTICS>
                        </FRAME>
                    </FRAMES>
                    <SUBCLASSES/>
                </VNSUBCLASS>
            </SUBCLASSES>
        </VNSUBCLASS>
        <VNSUBCLASS ID="hurt-40.8.3-2">
            <MEMBERS>
                <!--verb adds manner predicate for how the Patient is hurt-->
                <MEMBER name="bark" wn=""/>
                <MEMBER name="bite" wn="bite%2:35:00"/>
                <MEMBER name="bruise" wn="bruise%2:35:00"/>
                <MEMBER name="bump" wn="bump%2:35:00"/>
                <MEMBER name="burn" wn="burn%2:30:02 burn%2:39:00"/>
                <MEMBER name="cut" wn="cut%2:35:14"/>
                <MEMBER name="hurt" wn="hurt%2:29:01"/>
                <MEMBER name="injure" wn="injure%2:29:00"/>
                <MEMBER name="nick" wn="nick%2:35:01"/>
                <MEMBER name="prick" wn="prick%2:35:00 prick%2:35:03"/>
                <MEMBER name="scald" wn="scald%2:30:00"/>
                <MEMBER name="scratch" wn="scratch%2:35:00 ?scratch%2:39:00"/>
                <MEMBER name="skin" wn="skin%2:35:02"/>
                <MEMBER name="strain" wn="strain%2:34:00"/>
            </MEMBERS>
            <THEMROLES/>
            <FRAMES>
                <FRAME>
                    <DESCRIPTION descriptionNumber="7.6" primary="Unintentional Interpretation of Object" secondary="Body_part Object" xtag=""/>
                    <EXAMPLES>
                        <EXAMPLE>Tessa hurt/sprained her ankle.</EXAMPLE>
                    </EXAMPLES>
                    <SYNTAX>
                        <NP value="Experiencer">
                            <SYNRESTRS/>
                        </NP>
                        <VERB/>
                        <NP value="Patient">
                            <SYNRESTRS/>
                        </NP>
                    </SYNTAX>
                    <SEMANTICS>
                        <PRED value="harmed">
                            <ARGS>
                                <ARG type="Event" value="during(E)"/>
                                <ARG type="ThemRole" value="Patient"/>
                            </ARGS>
                        </PRED>
                        <PRED value="experience">
                            <ARGS>
                                <ARG type="Event" value="E"/>
                                <ARG type="ThemRole" value="Experiencer"/>
                            </ARGS>
                        </PRED>
                    </SEMANTICS>
                </FRAME>
                <FRAME>
                    <DESCRIPTION descriptionNumber="7.6" primary="Unintentional Interpretation of Object" secondary="Reflexive Object" xtag=""/>
                    <EXAMPLES>
                        <EXAMPLE>Tessa hurt herself.</EXAMPLE>
                    </EXAMPLES>
                    <SYNTAX>
                        <NP value="Experiencer">
                            <SYNRESTRS/>
                        </NP>
                        <VERB/>
                        <NP value="Patient">
                            <SYNRESTRS/>
                        </NP>
                    </SYNTAX>
                    <SEMANTICS>
                        <PRED value="harmed">
                            <ARGS>
                                <ARG type="Event" value="during(E)"/>
                                <ARG type="ThemRole" value="Patient"/>
                            </ARGS>
                        </PRED>
                        <PRED value="experience">
                            <ARGS>
                                <ARG type="Event" value="E"/>
                                <ARG type="ThemRole" value="Experiencer"/>
                            </ARGS>
                        </PRED>
                    </SEMANTICS>
                </FRAME>
            </FRAMES>
            <SUBCLASSES/>
        </VNSUBCLASS>
    </SUBCLASSES>
</VNCLASS>

