<?xml version="1.0" encoding="UTF-8"?>
<!DOCTYPE VNCLASS SYSTEM "vn_class-3.dtd">
<VNCLASS ID="poison-42.2" xmlns:xsi="http://www.w3.org/2001/XMLSchema-instance" xsi:noNamespaceSchemaLocation="vn_schema-3.xsd">
    <MEMBERS>
        <!--Each member adds a manner predicate-->
        <MEMBER name="asphyxiate" wn="asphyxiate%2:35:00"/>
        <MEMBER name="crucify" wn="crucify%2:41:00"/>
        <MEMBER name="drown" wn="drown%2:30:01"/>
        <MEMBER name="electrocute" wn="electrocute%2:41:00"/>
        <MEMBER name="garrotte" wn="garrotte%2:35:00"/>
        <MEMBER name="hang" wn="hang%2:41:00"/>
        <MEMBER name="knife" wn="knife%2:35:00"/>
        <MEMBER name="poison" wn="poison%2:35:00"/>
        <MEMBER name="shoot" wn="shoot%2:41:00"/>
        <MEMBER name="smother" wn="smother%2:35:00"/>
        <MEMBER name="stab" wn="stab%2:35:02"/>
        <MEMBER name="strangle" wn="strangle%2:35:00"/>
        <MEMBER name="suffocate" wn="suffocate%2:35:00"/>
    </MEMBERS>
    <THEMROLES>
        <THEMROLE type="Agent">
            <SELRESTRS>
                <SELRESTR Value="+" type="animate"/>
            </SELRESTRS>
        </THEMROLE>
        <THEMROLE type="Patient">
            <SELRESTRS>
                <SELRESTR Value="+" type="animate"/>
            </SELRESTRS>
        </THEMROLE>
        <THEMROLE type="Instrument">
            <SELRESTRS/>
        </THEMROLE>
    </THEMROLES>
    <FRAMES>
        <FRAME>
            <DESCRIPTION descriptionNumber="0.2" primary="Basic Transitive" secondary="" xtag="0.2"/>
            <EXAMPLES>
                <EXAMPLE>The witch poisoned Snow White.</EXAMPLE>
            </EXAMPLES>
            <SYNTAX>
                <NP value="Agent">
                    <SYNRESTRS/>
                </NP>
                <VERB/>
                <NP value="Patient">
                    <SYNRESTRS/>
                </NP>
            </SYNTAX>
            <SEMANTICS>
                <PRED value="cause">
                    <ARGS>
                        <ARG type="ThemRole" value="Agent"/>
                        <ARG type="Event" value="E"/>
                    </ARGS>
                </PRED>
                <PRED value="harmed">
                    <ARGS>
                        <ARG type="Event" value="during(E)"/>
                        <ARG type="ThemRole" value="Patient"/>
                    </ARGS>
                </PRED>
            </SEMANTICS>
        </FRAME>
        <FRAME>
            <DESCRIPTION descriptionNumber="0.4" primary="NP-ADJP" secondary="Resultative" xtag=""/>
            <EXAMPLES>
                <EXAMPLE>The Boston Strangler strangled his victims dead.</EXAMPLE>
            </EXAMPLES>
            <SYNTAX>
                <NP value="Agent">
                    <SYNRESTRS/>
                </NP>
                <VERB/>
                <NP value="Patient">
                    <SYNRESTRS/>
                </NP>
                <ADJ/>
            </SYNTAX>
            <SEMANTICS>
                <PRED value="cause">
                    <ARGS>
                        <ARG type="ThemRole" value="Agent"/>
                        <ARG type="Event" value="E"/>
                    </ARGS>
                </PRED>
                <PRED value="harmed">
                    <ARGS>
                        <ARG type="Event" value="during(E)"/>
                        <ARG type="ThemRole" value="Patient"/>
                    </ARGS>
                </PRED>
                <PRED value="Pred">
                    <ARGS>
                        <ARG type="Event" value="result(E)"/>
                        <ARG type="ThemRole" value="Patient"/>
                    </ARGS>
                </PRED>
            </SEMANTICS>
            <!--most verbs-->
        </FRAME>
        <FRAME>
            <DESCRIPTION descriptionNumber="0.4" primary="NP-PP" secondary="Result-PP" xtag=""/>
            <EXAMPLES>
                <EXAMPLE>The Boston Strangler strangled his victims to death.</EXAMPLE>
            </EXAMPLES>
            <SYNTAX>
                <NP value="Agent">
                    <SYNRESTRS/>
                </NP>
                <VERB/>
                <NP value="Patient">
                    <SYNRESTRS/>
                </NP>
                <PREP value="to into">
                    <SELRESTRS/>
                </PREP>
                <NP value="Oblique">
                    <SELRESTRS>
                        <SELRESTR Value="+" type="state"/>
                    </SELRESTRS>
                </NP>
            </SYNTAX>
            <SEMANTICS>
                <PRED value="cause">
                    <ARGS>
                        <ARG type="ThemRole" value="Agent"/>
                        <ARG type="Event" value="E"/>
                    </ARGS>
                </PRED>
                <PRED value="harmed">
                    <ARGS>
                        <ARG type="Event" value="during(E)"/>
                        <ARG type="ThemRole" value="Patient"/>
                    </ARGS>
                </PRED>
                <PRED value="Pred">
                    <ARGS>
                        <ARG type="Event" value="result(E)"/>
                        <ARG type="ThemRole" value="Patient"/>
                    </ARGS>
                </PRED>
            </SEMANTICS>
            <!--most verbs-->
        </FRAME>
        <FRAME>
            <DESCRIPTION descriptionNumber="" primary="NP-PP" secondary="Instrument-PP" xtag=""/>
            <EXAMPLES>
                <EXAMPLE>The queen poisoned Snow White with an apple.</EXAMPLE>
            </EXAMPLES>
            <SYNTAX>
                <NP value="Agent">
                    <SYNRESTRS/>
                </NP>
                <VERB/>
                <NP value="Patient">
                    <SYNRESTRS/>
                </NP>
                <PREP value="with">
                    <SELRESTRS/>
                </PREP>
                <NP value="Instrument">
                    <SYNRESTRS/>
                </NP>
            </SYNTAX>
            <SEMANTICS>
                <PRED value="cause">
                    <ARGS>
                        <ARG type="ThemRole" value="Agent"/>
                        <ARG type="Event" value="E"/>
                    </ARGS>
                </PRED>
                <PRED value="harmed">
                    <ARGS>
                        <ARG type="Event" value="during(E)"/>
                        <ARG type="ThemRole" value="Patient"/>
                    </ARGS>
                </PRED>
            </SEMANTICS>
        </FRAME>
    </FRAMES>
    <SUBCLASSES/>
</VNCLASS>
